{
  "id": "wechat-2247548118-1",
  "originalUrl": "https://mp.weixin.qq.com/s?__biz=MzI4OTQyNzA0Ng==&mid=2247548118&idx=1&sn=344c50be36ec78f7fff81b2ab213e520",
  "normalizedUrl": "https://mp.weixin.qq.com/s?__biz=MzI4OTQyNzA0Ng==&mid=2247548118&idx=1&sn=344c50be36ec78f7fff81b2ab213e520",
  "linkedPaperIds": [],
  "accessStatus": "blocked",
  "note": "2026-09-02 自动访问触发微信环境验证，标题、公众号、日期和关联论文均未确认；公开数据未保留临时分享参数。",
  "addedAt": "2026-09-02T00:00:00.000Z",
  "schemaVersion": "1.0.0"
}
