{
  "id": "wechat-2247483735-1",
  "originalUrl": "https://mp.weixin.qq.com/s?__biz=MzcxMDIyMzg4Ng==&mid=2247483735&idx=1&sn=ff056d061996901fded404c01c4dc0a9",
  "normalizedUrl": "https://mp.weixin.qq.com/s?__biz=MzcxMDIyMzg4Ng==&mid=2247483735&idx=1&sn=ff056d061996901fded404c01c4dc0a9",
  "linkedPaperIds": [],
  "accessStatus": "blocked",
  "note": "2026-09-02 自动访问触发微信环境验证，标题、公众号、日期和关联论文均未确认；公开数据未保留临时分享参数。",
  "addedAt": "2026-09-02T00:00:00.000Z",
  "schemaVersion": "1.0.0"
}
