{
  "id": "wechat-2247489844-1",
  "originalUrl": "https://mp.weixin.qq.com/s?__biz=Mzg3Mzc2MzA0Mw==&mid=2247489844&idx=1&sn=ef451dc00fa4fd3fb15df0aedb0a522c",
  "normalizedUrl": "https://mp.weixin.qq.com/s?__biz=Mzg3Mzc2MzA0Mw==&mid=2247489844&idx=1&sn=ef451dc00fa4fd3fb15df0aedb0a522c",
  "linkedPaperIds": [],
  "accessStatus": "blocked",
  "note": "2026-09-02 自动访问触发微信环境验证，标题、公众号、日期和关联论文均未确认；公开数据未保留临时分享参数。",
  "addedAt": "2026-09-02T00:00:00.000Z",
  "schemaVersion": "1.0.0"
}
